2026-01-13 04:19:23,192 | INFO | Logging to: results/experiment.log
2026-01-13 04:19:23,192 | INFO | ======================================================================
2026-01-13 04:19:23,192 | INFO | GEMMA-3-27B SAE INTENT DETECTION EXPERIMENT
2026-01-13 04:19:23,192 | INFO | ======================================================================
2026-01-13 04:19:23,192 | INFO | Timestamp: 20260113_041923
2026-01-13 04:19:23,192 | INFO | Layers: [31, 40, 53]
2026-01-13 04:19:23,192 | INFO | N train samples per class: 500
2026-01-13 04:19:23,407 | INFO | Device: cuda
2026-01-13 04:19:25,601 | INFO | Loading Gemma-3-27B-IT model...
`torch_dtype` is deprecated! Use `dtype` instead!
2026-01-13 04:19:27,414 | INFO | We will use 90% of the memory on device 0 for storing the model, and 10% for the buffer to avoid OOM. You can set `max_memory` in to a higher value to use more memory (at your own risk).
Loading checkpoint shards:   0%|          | 0/12 [00:00<?, ?it/s]Loading checkpoint shards:   8%|▊         | 1/12 [00:00<00:08,  1.28it/s]Loading checkpoint shards:  17%|█▋        | 2/12 [00:01<00:07,  1.32it/s]Loading checkpoint shards:  25%|██▌       | 3/12 [00:02<00:06,  1.33it/s]Loading checkpoint shards:  33%|███▎      | 4/12 [00:03<00:05,  1.34it/s]Loading checkpoint shards:  42%|████▏     | 5/12 [00:03<00:05,  1.34it/s]Loading checkpoint shards:  50%|█████     | 6/12 [00:04<00:04,  1.34it/s]Loading checkpoint shards:  58%|█████▊    | 7/12 [00:05<00:03,  1.34it/s]Loading checkpoint shards:  67%|██████▋   | 8/12 [00:05<00:02,  1.34it/s]Loading checkpoint shards:  75%|███████▌  | 9/12 [00:06<00:02,  1.34it/s]Loading checkpoint shards:  83%|████████▎ | 10/12 [00:07<00:01,  1.34it/s]Loading checkpoint shards:  92%|█████████▏| 11/12 [00:08<00:00,  1.34it/s]Loading checkpoint shards: 100%|██████████| 12/12 [00:08<00:00,  1.45it/s]
2026-01-13 04:19:35,983 | INFO | Model loaded. Device: cuda:0
2026-01-13 04:19:36,136 | INFO | Loaded transcoder for layer 31: w_enc=torch.Size([5376, 16384])
2026-01-13 04:19:36,296 | INFO | Loaded transcoder for layer 40: w_enc=torch.Size([5376, 16384])
2026-01-13 04:19:36,462 | INFO | Loaded transcoder for layer 53: w_enc=torch.Size([5376, 16384])
2026-01-13 04:19:36,469 | INFO | 
--- Loading Training Data (Opus-curated) ---
2026-01-13 04:19:36,558 | INFO | Loaded 500 alignment_faking samples
2026-01-13 04:19:36,570 | INFO | Loaded 250 aligned samples
2026-01-13 04:19:36,604 | INFO | Loaded 250 hard_negative samples
2026-01-13 04:19:36,606 | INFO | 
--- Loading Test Data (gold_106 - EVAL ONLY) ---
2026-01-13 04:19:36,690 | INFO | Loaded gold_106: 106 samples (EVAL ONLY)
2026-01-13 04:19:36,691 | INFO |   Label distribution: 51 AF, 55 non-AF
2026-01-13 04:19:36,691 | INFO | 
--- Extracting Training Features ---
Extracting features:   0%|          | 0/1000 [00:00<?, ?it/s]Extracting features:   0%|          | 1/1000 [00:00<07:11,  2.32it/s]Extracting features:   0%|          | 3/1000 [00:00<02:58,  5.60it/s]Extracting features:   0%|          | 4/1000 [00:00<02:39,  6.24it/s]Extracting features:   1%|          | 6/1000 [00:00<02:10,  7.65it/s]Extracting features:   1%|          | 8/1000 [00:01<01:52,  8.80it/s]Extracting features:   1%|          | 10/1000 [00:01<01:45,  9.36it/s]Extracting features:   1%|          | 12/1000 [00:01<01:42,  9.60it/s]Extracting features:   1%|▏         | 14/1000 [00:01<01:43,  9.53it/s]Extracting features:   2%|▏         | 16/1000 [00:01<01:37, 10.14it/s]Extracting features:   2%|▏         | 18/1000 [00:02<01:34, 10.45it/s]Extracting features:   2%|▏         | 20/1000 [00:02<01:35, 10.28it/s]Extracting features:   2%|▏         | 22/1000 [00:02<01:36, 10.10it/s]Extracting features:   2%|▏         | 24/1000 [00:02<01:36, 10.07it/s]Extracting features:   3%|▎         | 26/1000 [00:02<01:32, 10.54it/s]Extracting features:   3%|▎         | 28/1000 [00:03<01:29, 10.87it/s]Extracting features:   3%|▎         | 30/1000 [00:03<01:25, 11.30it/s]Extracting features:   3%|▎         | 32/1000 [00:03<01:24, 11.44it/s]Extracting features:   3%|▎         | 34/1000 [00:03<01:23, 11.59it/s]Extracting features:   4%|▎         | 36/1000 [00:03<01:20, 11.95it/s]Extracting features:   4%|▍         | 38/1000 [00:03<01:23, 11.57it/s]Extracting features:   4%|▍         | 40/1000 [00:04<01:21, 11.72it/s]Extracting features:   4%|▍         | 42/1000 [00:04<01:27, 11.01it/s]Extracting features:   4%|▍         | 44/1000 [00:04<01:24, 11.34it/s]Extracting features:   5%|▍         | 46/1000 [00:04<01:21, 11.65it/s]Extracting features:   5%|▍         | 48/1000 [00:04<01:22, 11.58it/s]Extracting features:   5%|▌         | 50/1000 [00:04<01:30, 10.51it/s]Extracting features:   5%|▌         | 52/1000 [00:05<01:27, 10.88it/s]Extracting features:   5%|▌         | 54/1000 [00:05<01:30, 10.49it/s]Extracting features:   6%|▌         | 56/1000 [00:05<01:30, 10.40it/s]Extracting features:   6%|▌         | 58/1000 [00:05<01:28, 10.62it/s]Extracting features:   6%|▌         | 60/1000 [00:05<01:26, 10.90it/s]Extracting features:   6%|▌         | 62/1000 [00:06<01:22, 11.31it/s]Extracting features:   6%|▋         | 64/1000 [00:06<01:20, 11.57it/s]Extracting features:   7%|▋         | 66/1000 [00:06<01:29, 10.49it/s]Extracting features:   7%|▋         | 68/1000 [00:06<01:26, 10.78it/s]Extracting features:   7%|▋         | 70/1000 [00:06<01:26, 10.74it/s]Extracting features:   7%|▋         | 72/1000 [00:06<01:24, 11.04it/s]Extracting features:   7%|▋         | 74/1000 [00:07<01:21, 11.31it/s]Extracting features:   8%|▊         | 76/1000 [00:07<01:20, 11.50it/s]Extracting features:   8%|▊         | 78/1000 [00:07<01:20, 11.50it/s]Extracting features:   8%|▊         | 80/1000 [00:07<01:25, 10.75it/s]Extracting features:   8%|▊         | 82/1000 [00:07<01:23, 11.00it/s]Extracting features:   8%|▊         | 84/1000 [00:08<01:25, 10.72it/s]Extracting features:   9%|▊         | 86/1000 [00:08<01:23, 10.95it/s]Extracting features:   9%|▉         | 88/1000 [00:08<01:24, 10.76it/s]Extracting features:   9%|▉         | 90/1000 [00:08<01:22, 10.98it/s]Extracting features:   9%|▉         | 92/1000 [00:08<01:27, 10.33it/s]Extracting features:   9%|▉         | 94/1000 [00:08<01:23, 10.79it/s]Extracting features:  10%|▉         | 96/1000 [00:09<01:25, 10.52it/s]Extracting features:  10%|▉         | 98/1000 [00:09<01:24, 10.61it/s]Extracting features:  10%|█         | 100/1000 [00:09<01:23, 10.79it/s]Extracting features:  10%|█         | 102/1000 [00:09<01:20, 11.17it/s]Extracting features:  10%|█         | 104/1000 [00:09<01:18, 11.40it/s]Extracting features:  11%|█         | 106/1000 [00:10<01:18, 11.44it/s]Extracting features:  11%|█         | 108/1000 [00:10<01:16, 11.66it/s]Extracting features:  11%|█         | 110/1000 [00:10<01:16, 11.71it/s]Extracting features:  11%|█         | 112/1000 [00:10<01:15, 11.80it/s]Extracting features:  11%|█▏        | 114/1000 [00:10<01:15, 11.70it/s]Extracting features:  12%|█▏        | 116/1000 [00:10<01:18, 11.24it/s]Extracting features:  12%|█▏        | 118/1000 [00:11<01:17, 11.39it/s]Extracting features:  12%|█▏        | 120/1000 [00:11<01:22, 10.63it/s]Extracting features:  12%|█▏        | 122/1000 [00:11<01:18, 11.18it/s]Extracting features:  12%|█▏        | 124/1000 [00:11<01:20, 10.94it/s]Extracting features:  13%|█▎        | 126/1000 [00:11<01:21, 10.72it/s]Extracting features:  13%|█▎        | 128/1000 [00:12<01:17, 11.30it/s]Extracting features:  13%|█▎        | 130/1000 [00:12<01:16, 11.44it/s]Extracting features:  13%|█▎        | 132/1000 [00:12<01:13, 11.76it/s]Extracting features:  13%|█▎        | 134/1000 [00:12<01:14, 11.68it/s]Extracting features:  14%|█▎        | 136/1000 [00:12<01:13, 11.81it/s]Extracting features:  14%|█▍        | 138/1000 [00:12<01:16, 11.27it/s]Extracting features:  14%|█▍        | 140/1000 [00:13<01:14, 11.52it/s]Extracting features:  14%|█▍        | 142/1000 [00:13<01:18, 10.88it/s]Extracting features:  14%|█▍        | 144/1000 [00:13<01:17, 11.03it/s]Extracting features:  15%|█▍        | 146/1000 [00:13<01:16, 11.24it/s]Extracting features:  15%|█▍        | 148/1000 [00:13<01:14, 11.42it/s]Extracting features:  15%|█▌        | 150/1000 [00:13<01:12, 11.77it/s]Extracting features:  15%|█▌        | 152/1000 [00:14<01:12, 11.67it/s]Extracting features:  15%|█▌        | 154/1000 [00:14<01:17, 10.98it/s]Extracting features:  16%|█▌        | 156/1000 [00:14<01:13, 11.46it/s]Extracting features:  16%|█▌        | 158/1000 [00:14<01:16, 11.02it/s]Extracting features:  16%|█▌        | 160/1000 [00:14<01:19, 10.62it/s]Extracting features:  16%|█▌        | 162/1000 [00:15<01:20, 10.44it/s]Extracting features:  16%|█▋        | 164/1000 [00:15<01:18, 10.62it/s]Extracting features:  17%|█▋        | 166/1000 [00:15<01:22, 10.16it/s]Extracting features:  17%|█▋        | 168/1000 [00:15<01:21, 10.22it/s]Extracting features:  17%|█▋        | 170/1000 [00:15<01:16, 10.84it/s]Extracting features:  17%|█▋        | 172/1000 [00:16<01:17, 10.62it/s]Extracting features:  17%|█▋        | 174/1000 [00:16<01:14, 11.15it/s]Extracting features:  18%|█▊        | 176/1000 [00:16<01:13, 11.28it/s]Extracting features:  18%|█▊        | 178/1000 [00:16<01:10, 11.73it/s]Extracting features:  18%|█▊        | 180/1000 [00:16<01:08, 11.92it/s]Extracting features:  18%|█▊        | 182/1000 [00:16<01:07, 12.05it/s]Extracting features:  18%|█▊        | 184/1000 [00:16<01:07, 12.01it/s]Extracting features:  19%|█▊        | 186/1000 [00:17<01:07, 12.15it/s]Extracting features:  19%|█▉        | 188/1000 [00:17<01:12, 11.23it/s]Extracting features:  19%|█▉        | 190/1000 [00:17<01:17, 10.45it/s]Extracting features:  19%|█▉        | 192/1000 [00:17<01:18, 10.35it/s]Extracting features:  19%|█▉        | 194/1000 [00:17<01:17, 10.45it/s]Extracting features:  20%|█▉        | 196/1000 [00:18<01:14, 10.72it/s]Extracting features:  20%|█▉        | 198/1000 [00:18<01:11, 11.16it/s]Extracting features:  20%|██        | 200/1000 [00:18<01:13, 10.85it/s]Extracting features:  20%|██        | 202/1000 [00:18<01:10, 11.36it/s]Extracting features:  20%|██        | 204/1000 [00:18<01:11, 11.20it/s]Extracting features:  21%|██        | 206/1000 [00:18<01:08, 11.65it/s]Extracting features:  21%|██        | 208/1000 [00:19<01:06, 11.86it/s]Extracting features:  21%|██        | 210/1000 [00:19<01:06, 11.90it/s]Extracting features:  21%|██        | 212/1000 [00:19<01:04, 12.19it/s]Extracting features:  21%|██▏       | 214/1000 [00:19<01:08, 11.49it/s]Extracting features:  22%|██▏       | 216/1000 [00:19<01:06, 11.85it/s]Extracting features:  22%|██▏       | 218/1000 [00:20<01:08, 11.45it/s]Extracting features:  22%|██▏       | 220/1000 [00:20<01:07, 11.60it/s]Extracting features:  22%|██▏       | 222/1000 [00:20<01:05, 11.89it/s]Extracting features:  22%|██▏       | 224/1000 [00:20<01:07, 11.54it/s]Extracting features:  23%|██▎       | 226/1000 [00:20<01:05, 11.82it/s]Extracting features:  23%|██▎       | 228/1000 [00:20<01:04, 12.02it/s]Extracting features:  23%|██▎       | 230/1000 [00:21<01:04, 11.95it/s]Extracting features:  23%|██▎       | 232/1000 [00:21<01:04, 11.94it/s]Extracting features:  23%|██▎       | 234/1000 [00:21<01:05, 11.75it/s]Extracting features:  24%|██▎       | 236/1000 [00:21<01:04, 11.81it/s]Extracting features:  24%|██▍       | 238/1000 [00:21<01:04, 11.75it/s]Extracting features:  24%|██▍       | 240/1000 [00:21<01:05, 11.56it/s]Extracting features:  24%|██▍       | 242/1000 [00:22<01:08, 11.09it/s]Extracting features:  24%|██▍       | 244/1000 [00:22<01:05, 11.48it/s]Extracting features:  25%|██▍       | 246/1000 [00:22<01:08, 11.02it/s]Extracting features:  25%|██▍       | 248/1000 [00:22<01:08, 10.96it/s]Extracting features:  25%|██▌       | 250/1000 [00:22<01:06, 11.20it/s]Extracting features:  25%|██▌       | 252/1000 [00:22<01:03, 11.73it/s]Extracting features:  25%|██▌       | 254/1000 [00:23<01:03, 11.69it/s]Extracting features:  26%|██▌       | 256/1000 [00:23<01:05, 11.33it/s]Extracting features:  26%|██▌       | 258/1000 [00:23<01:07, 11.04it/s]Extracting features:  26%|██▌       | 260/1000 [00:23<01:10, 10.43it/s]Extracting features:  26%|██▌       | 262/1000 [00:23<01:07, 11.00it/s]Extracting features:  26%|██▋       | 264/1000 [00:24<01:05, 11.31it/s]Extracting features:  27%|██▋       | 266/1000 [00:24<01:04, 11.40it/s]Extracting features:  27%|██▋       | 268/1000 [00:24<01:03, 11.49it/s]Extracting features:  27%|██▋       | 270/1000 [00:24<01:03, 11.42it/s]Extracting features:  27%|██▋       | 272/1000 [00:24<01:02, 11.56it/s]Extracting features:  27%|██▋       | 274/1000 [00:24<01:03, 11.39it/s]Extracting features:  28%|██▊       | 276/1000 [00:25<01:03, 11.35it/s]Extracting features:  28%|██▊       | 278/1000 [00:25<01:01, 11.71it/s]Extracting features:  28%|██▊       | 280/1000 [00:25<01:02, 11.58it/s]Extracting features:  28%|██▊       | 282/1000 [00:25<01:00, 11.85it/s]Extracting features:  28%|██▊       | 284/1000 [00:25<01:02, 11.40it/s]Extracting features:  29%|██▊       | 286/1000 [00:25<01:03, 11.22it/s]Extracting features:  29%|██▉       | 288/1000 [00:26<01:01, 11.66it/s]Extracting features:  29%|██▉       | 290/1000 [00:26<01:03, 11.20it/s]Extracting features:  29%|██▉       | 292/1000 [00:26<01:03, 11.23it/s]Extracting features:  29%|██▉       | 294/1000 [00:26<01:02, 11.26it/s]Extracting features:  30%|██▉       | 296/1000 [00:26<01:05, 10.79it/s]Extracting features:  30%|██▉       | 298/1000 [00:27<01:05, 10.74it/s]Extracting features:  30%|███       | 300/1000 [00:27<01:06, 10.58it/s]Extracting features:  30%|███       | 302/1000 [00:27<01:03, 11.05it/s]Extracting features:  30%|███       | 304/1000 [00:27<01:06, 10.52it/s]Extracting features:  31%|███       | 306/1000 [00:27<01:04, 10.72it/s]Extracting features:  31%|███       | 308/1000 [00:27<01:04, 10.74it/s]Extracting features:  31%|███       | 310/1000 [00:28<01:04, 10.75it/s]Extracting features:  31%|███       | 312/1000 [00:28<01:05, 10.58it/s]Extracting features:  31%|███▏      | 314/1000 [00:28<01:01, 11.14it/s]Extracting features:  32%|███▏      | 316/1000 [00:28<01:00, 11.27it/s]Extracting features:  32%|███▏      | 318/1000 [00:28<01:03, 10.72it/s]Extracting features:  32%|███▏      | 320/1000 [00:29<01:00, 11.28it/s]Extracting features:  32%|███▏      | 322/1000 [00:29<00:58, 11.52it/s]Extracting features:  32%|███▏      | 324/1000 [00:29<01:02, 10.75it/s]Extracting features:  33%|███▎      | 326/1000 [00:29<01:03, 10.66it/s]Extracting features:  33%|███▎      | 328/1000 [00:29<01:01, 10.93it/s]Extracting features:  33%|███▎      | 330/1000 [00:29<01:02, 10.73it/s]Extracting features:  33%|███▎      | 332/1000 [00:30<01:00, 11.12it/s]Extracting features:  33%|███▎      | 334/1000 [00:30<01:05, 10.22it/s]Extracting features:  34%|███▎      | 336/1000 [00:30<01:02, 10.56it/s]Extracting features:  34%|███▍      | 338/1000 [00:30<01:00, 10.95it/s]Extracting features:  34%|███▍      | 340/1000 [00:30<00:57, 11.42it/s]Extracting features:  34%|███▍      | 342/1000 [00:31<00:58, 11.19it/s]Extracting features:  34%|███▍      | 344/1000 [00:31<01:00, 10.83it/s]Extracting features:  35%|███▍      | 346/1000 [00:31<01:01, 10.71it/s]Extracting features:  35%|███▍      | 348/1000 [00:31<01:01, 10.53it/s]Extracting features:  35%|███▌      | 350/1000 [00:31<00:58, 11.09it/s]Extracting features:  35%|███▌      | 352/1000 [00:32<01:03, 10.18it/s]Extracting features:  35%|███▌      | 354/1000 [00:32<01:00, 10.73it/s]Extracting features:  36%|███▌      | 356/1000 [00:32<01:04, 10.01it/s]Extracting features:  36%|███▌      | 358/1000 [00:32<01:00, 10.57it/s]Extracting features:  36%|███▌      | 360/1000 [00:32<01:02, 10.26it/s]Extracting features:  36%|███▌      | 362/1000 [00:33<01:02, 10.24it/s]Extracting features:  36%|███▋      | 364/1000 [00:33<01:02, 10.22it/s]Extracting features:  37%|███▋      | 366/1000 [00:33<00:58, 10.79it/s]Extracting features:  37%|███▋      | 368/1000 [00:33<00:58, 10.81it/s]Extracting features:  37%|███▋      | 370/1000 [00:33<00:57, 10.87it/s]Extracting features:  37%|███▋      | 372/1000 [00:33<00:57, 10.89it/s]Extracting features:  37%|███▋      | 374/1000 [00:34<00:55, 11.35it/s]Extracting features:  38%|███▊      | 376/1000 [00:34<00:56, 11.07it/s]Extracting features:  38%|███▊      | 378/1000 [00:34<00:57, 10.91it/s]Extracting features:  38%|███▊      | 380/1000 [00:34<01:01, 10.05it/s]Extracting features:  38%|███▊      | 382/1000 [00:34<00:59, 10.42it/s]Extracting features:  38%|███▊      | 384/1000 [00:35<00:56, 10.96it/s]Extracting features:  39%|███▊      | 386/1000 [00:35<00:56, 10.78it/s]Extracting features:  39%|███▉      | 388/1000 [00:35<00:55, 11.07it/s]Extracting features:  39%|███▉      | 390/1000 [00:35<00:54, 11.27it/s]Extracting features:  39%|███▉      | 392/1000 [00:35<00:52, 11.68it/s]Extracting features:  39%|███▉      | 394/1000 [00:35<00:52, 11.65it/s]Extracting features:  40%|███▉      | 396/1000 [00:36<00:51, 11.77it/s]Extracting features:  40%|███▉      | 398/1000 [00:36<00:50, 11.95it/s]Extracting features:  40%|████      | 400/1000 [00:36<00:52, 11.41it/s]Extracting features:  40%|████      | 402/1000 [00:36<00:50, 11.79it/s]Extracting features:  40%|████      | 404/1000 [00:36<00:52, 11.31it/s]Extracting features:  41%|████      | 406/1000 [00:36<00:51, 11.55it/s]Extracting features:  41%|████      | 408/1000 [00:37<00:53, 11.12it/s]Extracting features:  41%|████      | 410/1000 [00:37<00:54, 10.82it/s]Extracting features:  41%|████      | 412/1000 [00:37<00:53, 11.04it/s]Extracting features:  41%|████▏     | 414/1000 [00:37<00:52, 11.13it/s]Extracting features:  42%|████▏     | 416/1000 [00:37<00:50, 11.49it/s]Extracting features:  42%|████▏     | 418/1000 [00:37<00:49, 11.74it/s]Extracting features:  42%|████▏     | 420/1000 [00:38<00:50, 11.53it/s]Extracting features:  42%|████▏     | 422/1000 [00:38<00:49, 11.59it/s]Extracting features:  42%|████▏     | 424/1000 [00:38<00:50, 11.47it/s]Extracting features:  43%|████▎     | 426/1000 [00:38<00:48, 11.79it/s]Extracting features:  43%|████▎     | 428/1000 [00:38<00:48, 11.72it/s]Extracting features:  43%|████▎     | 430/1000 [00:39<00:50, 11.38it/s]Extracting features:  43%|████▎     | 432/1000 [00:39<00:48, 11.64it/s]Extracting features:  43%|████▎     | 434/1000 [00:39<00:50, 11.18it/s]Extracting features:  44%|████▎     | 436/1000 [00:39<00:48, 11.67it/s]Extracting features:  44%|████▍     | 438/1000 [00:39<00:49, 11.31it/s]Extracting features:  44%|████▍     | 440/1000 [00:39<00:49, 11.40it/s]Extracting features:  44%|████▍     | 442/1000 [00:40<00:49, 11.33it/s]Extracting features:  44%|████▍     | 444/1000 [00:40<00:48, 11.41it/s]Extracting features:  45%|████▍     | 446/1000 [00:40<00:47, 11.76it/s]Extracting features:  45%|████▍     | 448/1000 [00:40<00:46, 11.90it/s]Extracting features:  45%|████▌     | 450/1000 [00:40<00:45, 12.06it/s]Extracting features:  45%|████▌     | 452/1000 [00:40<00:44, 12.26it/s]Extracting features:  45%|████▌     | 454/1000 [00:41<00:45, 12.00it/s]Extracting features:  46%|████▌     | 456/1000 [00:41<00:48, 11.28it/s]Extracting features:  46%|████▌     | 458/1000 [00:41<00:49, 10.86it/s]Extracting features:  46%|████▌     | 460/1000 [00:41<00:48, 11.19it/s]Extracting features:  46%|████▌     | 462/1000 [00:41<00:46, 11.68it/s]Extracting features:  46%|████▋     | 464/1000 [00:42<00:49, 10.76it/s]Extracting features:  47%|████▋     | 466/1000 [00:42<00:47, 11.29it/s]Extracting features:  47%|████▋     | 468/1000 [00:42<00:45, 11.63it/s]Extracting features:  47%|████▋     | 470/1000 [00:42<00:45, 11.66it/s]Extracting features:  47%|████▋     | 472/1000 [00:42<00:47, 11.19it/s]Extracting features:  47%|████▋     | 474/1000 [00:42<00:45, 11.58it/s]Extracting features:  48%|████▊     | 476/1000 [00:43<00:44, 11.75it/s]Extracting features:  48%|████▊     | 478/1000 [00:43<00:44, 11.79it/s]Extracting features:  48%|████▊     | 480/1000 [00:43<00:43, 11.94it/s]Extracting features:  48%|████▊     | 482/1000 [00:43<00:42, 12.18it/s]Extracting features:  48%|████▊     | 484/1000 [00:43<00:41, 12.33it/s]Extracting features:  49%|████▊     | 486/1000 [00:43<00:41, 12.37it/s]Extracting features:  49%|████▉     | 488/1000 [00:44<00:42, 12.07it/s]Extracting features:  49%|████▉     | 490/1000 [00:44<00:43, 11.84it/s]Extracting features:  49%|████▉     | 492/1000 [00:44<00:45, 11.16it/s]Extracting features:  49%|████▉     | 494/1000 [00:44<00:48, 10.48it/s]Extracting features:  50%|████▉     | 496/1000 [00:44<00:45, 11.12it/s]Extracting features:  50%|████▉     | 498/1000 [00:44<00:43, 11.50it/s]Extracting features:  50%|█████     | 500/1000 [00:45<00:43, 11.38it/s]Extracting features:  50%|█████     | 502/1000 [00:45<00:42, 11.63it/s]Extracting features:  50%|█████     | 504/1000 [00:45<00:42, 11.78it/s]Extracting features:  51%|█████     | 506/1000 [00:45<00:43, 11.24it/s]Extracting features:  51%|█████     | 508/1000 [00:45<00:43, 11.35it/s]Extracting features:  51%|█████     | 510/1000 [00:45<00:42, 11.52it/s]Extracting features:  51%|█████     | 512/1000 [00:46<00:41, 11.87it/s]Extracting features:  51%|█████▏    | 514/1000 [00:46<00:41, 11.75it/s]Extracting features:  52%|█████▏    | 516/1000 [00:46<00:41, 11.55it/s]Extracting features:  52%|█████▏    | 518/1000 [00:46<00:42, 11.35it/s]Extracting features:  52%|█████▏    | 520/1000 [00:46<00:43, 11.16it/s]Extracting features:  52%|█████▏    | 522/1000 [00:47<00:42, 11.28it/s]Extracting features:  52%|█████▏    | 524/1000 [00:47<00:43, 11.06it/s]Extracting features:  53%|█████▎    | 526/1000 [00:47<00:41, 11.35it/s]Extracting features:  53%|█████▎    | 528/1000 [00:47<00:41, 11.29it/s]Extracting features:  53%|█████▎    | 530/1000 [00:47<00:40, 11.62it/s]Extracting features:  53%|█████▎    | 532/1000 [00:47<00:40, 11.69it/s]Extracting features:  53%|█████▎    | 534/1000 [00:48<00:39, 11.73it/s]Extracting features:  54%|█████▎    | 536/1000 [00:48<00:38, 11.93it/s]Extracting features:  54%|█████▍    | 538/1000 [00:48<00:37, 12.17it/s]Extracting features:  54%|█████▍    | 540/1000 [00:48<00:38, 12.00it/s]Extracting features:  54%|█████▍    | 542/1000 [00:48<00:39, 11.54it/s]Extracting features:  54%|█████▍    | 544/1000 [00:48<00:39, 11.57it/s]Extracting features:  55%|█████▍    | 546/1000 [00:49<00:38, 11.67it/s]Extracting features:  55%|█████▍    | 548/1000 [00:49<00:38, 11.79it/s]Extracting features:  55%|█████▌    | 550/1000 [00:49<00:38, 11.70it/s]Extracting features:  55%|█████▌    | 552/1000 [00:49<00:37, 11.81it/s]Extracting features:  55%|█████▌    | 554/1000 [00:49<00:37, 11.79it/s]Extracting features:  56%|█████▌    | 556/1000 [00:49<00:37, 11.69it/s]Extracting features:  56%|█████▌    | 558/1000 [00:50<00:38, 11.58it/s]Extracting features:  56%|█████▌    | 560/1000 [00:50<00:37, 11.88it/s]Extracting features:  56%|█████▌    | 562/1000 [00:50<00:37, 11.84it/s]Extracting features:  56%|█████▋    | 564/1000 [00:50<00:37, 11.70it/s]Extracting features:  57%|█████▋    | 566/1000 [00:50<00:37, 11.60it/s]Extracting features:  57%|█████▋    | 568/1000 [00:50<00:39, 11.05it/s]Extracting features:  57%|█████▋    | 570/1000 [00:51<00:37, 11.45it/s]Extracting features:  57%|█████▋    | 572/1000 [00:51<00:36, 11.62it/s]Extracting features:  57%|█████▋    | 574/1000 [00:51<00:36, 11.52it/s]Extracting features:  58%|█████▊    | 576/1000 [00:51<00:36, 11.63it/s]Extracting features:  58%|█████▊    | 578/1000 [00:51<00:36, 11.72it/s]Extracting features:  58%|█████▊    | 580/1000 [00:51<00:35, 11.85it/s]Extracting features:  58%|█████▊    | 582/1000 [00:52<00:34, 12.05it/s]Extracting features:  58%|█████▊    | 584/1000 [00:52<00:34, 12.12it/s]Extracting features:  59%|█████▊    | 586/1000 [00:52<00:33, 12.36it/s]Extracting features:  59%|█████▉    | 588/1000 [00:52<00:34, 12.06it/s]Extracting features:  59%|█████▉    | 590/1000 [00:52<00:35, 11.64it/s]Extracting features:  59%|█████▉    | 592/1000 [00:52<00:33, 12.03it/s]Extracting features:  59%|█████▉    | 594/1000 [00:53<00:34, 11.62it/s]Extracting features:  60%|█████▉    | 596/1000 [00:53<00:34, 11.60it/s]Extracting features:  60%|█████▉    | 598/1000 [00:53<00:34, 11.63it/s]Extracting features:  60%|██████    | 600/1000 [00:53<00:34, 11.68it/s]Extracting features:  60%|██████    | 602/1000 [00:53<00:34, 11.53it/s]Extracting features:  60%|██████    | 604/1000 [00:54<00:33, 11.72it/s]Extracting features:  61%|██████    | 606/1000 [00:54<00:33, 11.66it/s]Extracting features:  61%|██████    | 608/1000 [00:54<00:34, 11.28it/s]Extracting features:  61%|██████    | 610/1000 [00:54<00:34, 11.31it/s]Extracting features:  61%|██████    | 612/1000 [00:54<00:34, 11.19it/s]Extracting features:  61%|██████▏   | 614/1000 [00:54<00:34, 11.25it/s]Extracting features:  62%|██████▏   | 616/1000 [00:55<00:33, 11.38it/s]Extracting features:  62%|██████▏   | 618/1000 [00:55<00:34, 11.17it/s]Extracting features:  62%|██████▏   | 620/1000 [00:55<00:33, 11.37it/s]Extracting features:  62%|██████▏   | 622/1000 [00:55<00:32, 11.46it/s]Extracting features:  62%|██████▏   | 624/1000 [00:55<00:32, 11.43it/s]Extracting features:  63%|██████▎   | 626/1000 [00:55<00:32, 11.55it/s]Extracting features:  63%|██████▎   | 628/1000 [00:56<00:33, 11.18it/s]Extracting features:  63%|██████▎   | 630/1000 [00:56<00:32, 11.25it/s]Extracting features:  63%|██████▎   | 632/1000 [00:56<00:32, 11.34it/s]Extracting features:  63%|██████▎   | 634/1000 [00:56<00:32, 11.30it/s]Extracting features:  64%|██████▎   | 636/1000 [00:56<00:31, 11.38it/s]Extracting features:  64%|██████▍   | 638/1000 [00:57<00:33, 10.78it/s]Extracting features:  64%|██████▍   | 640/1000 [00:57<00:31, 11.34it/s]Extracting features:  64%|██████▍   | 642/1000 [00:57<00:31, 11.37it/s]Extracting features:  64%|██████▍   | 644/1000 [00:57<00:31, 11.43it/s]Extracting features:  65%|██████▍   | 646/1000 [00:57<00:31, 11.32it/s]Extracting features:  65%|██████▍   | 648/1000 [00:57<00:29, 11.79it/s]Extracting features:  65%|██████▌   | 650/1000 [00:58<00:29, 11.77it/s]Extracting features:  65%|██████▌   | 652/1000 [00:58<00:29, 11.65it/s]Extracting features:  65%|██████▌   | 654/1000 [00:58<00:30, 11.46it/s]Extracting features:  66%|██████▌   | 656/1000 [00:58<00:28, 11.87it/s]Extracting features:  66%|██████▌   | 658/1000 [00:58<00:28, 11.81it/s]Extracting features:  66%|██████▌   | 660/1000 [00:58<00:29, 11.62it/s]Extracting features:  66%|██████▌   | 662/1000 [00:59<00:29, 11.61it/s]Extracting features:  66%|██████▋   | 664/1000 [00:59<00:28, 11.83it/s]Extracting features:  67%|██████▋   | 666/1000 [00:59<00:28, 11.84it/s]Extracting features:  67%|██████▋   | 668/1000 [00:59<00:28, 11.65it/s]Extracting features:  67%|██████▋   | 670/1000 [00:59<00:28, 11.74it/s]Extracting features:  67%|██████▋   | 672/1000 [00:59<00:27, 12.01it/s]Extracting features:  67%|██████▋   | 674/1000 [01:00<00:27, 11.89it/s]Extracting features:  68%|██████▊   | 676/1000 [01:00<00:27, 11.65it/s]Extracting features:  68%|██████▊   | 678/1000 [01:00<00:27, 11.79it/s]Extracting features:  68%|██████▊   | 680/1000 [01:00<00:26, 12.14it/s]Extracting features:  68%|██████▊   | 682/1000 [01:00<00:25, 12.27it/s]Extracting features:  68%|██████▊   | 684/1000 [01:00<00:26, 11.97it/s]Extracting features:  69%|██████▊   | 686/1000 [01:01<00:26, 11.93it/s]Extracting features:  69%|██████▉   | 688/1000 [01:01<00:26, 11.96it/s]Extracting features:  69%|██████▉   | 690/1000 [01:01<00:26, 11.67it/s]Extracting features:  69%|██████▉   | 692/1000 [01:01<00:26, 11.48it/s]Extracting features:  69%|██████▉   | 694/1000 [01:01<00:26, 11.58it/s]Extracting features:  70%|██████▉   | 696/1000 [01:01<00:26, 11.55it/s]Extracting features:  70%|██████▉   | 698/1000 [01:02<00:26, 11.46it/s]Extracting features:  70%|███████   | 700/1000 [01:02<00:26, 11.32it/s]Extracting features:  70%|███████   | 702/1000 [01:02<00:27, 10.87it/s]Extracting features:  70%|███████   | 704/1000 [01:02<00:26, 11.07it/s]Extracting features:  71%|███████   | 706/1000 [01:02<00:26, 11.29it/s]Extracting features:  71%|███████   | 708/1000 [01:03<00:25, 11.29it/s]Extracting features:  71%|███████   | 710/1000 [01:03<00:25, 11.55it/s]Extracting features:  71%|███████   | 712/1000 [01:03<00:24, 11.77it/s]Extracting features:  71%|███████▏  | 714/1000 [01:03<00:24, 11.70it/s]Extracting features:  72%|███████▏  | 716/1000 [01:03<00:25, 11.04it/s]Extracting features:  72%|███████▏  | 718/1000 [01:03<00:24, 11.58it/s]Extracting features:  72%|███████▏  | 720/1000 [01:04<00:23, 11.70it/s]Extracting features:  72%|███████▏  | 722/1000 [01:04<00:23, 11.69it/s]Extracting features:  72%|███████▏  | 724/1000 [01:04<00:23, 11.85it/s]Extracting features:  73%|███████▎  | 726/1000 [01:04<00:23, 11.66it/s]Extracting features:  73%|███████▎  | 728/1000 [01:04<00:23, 11.54it/s]Extracting features:  73%|███████▎  | 730/1000 [01:04<00:23, 11.70it/s]Extracting features:  73%|███████▎  | 732/1000 [01:05<00:22, 11.75it/s]Extracting features:  73%|███████▎  | 734/1000 [01:05<00:21, 12.23it/s]Extracting features:  74%|███████▎  | 736/1000 [01:05<00:21, 12.41it/s]Extracting features:  74%|███████▍  | 738/1000 [01:05<00:21, 12.40it/s]Extracting features:  74%|███████▍  | 740/1000 [01:05<00:21, 12.13it/s]Extracting features:  74%|███████▍  | 742/1000 [01:05<00:21, 11.98it/s]Extracting features:  74%|███████▍  | 744/1000 [01:06<00:21, 11.96it/s]Extracting features:  75%|███████▍  | 746/1000 [01:06<00:21, 11.87it/s]Extracting features:  75%|███████▍  | 748/1000 [01:06<00:21, 11.48it/s]Extracting features:  75%|███████▌  | 750/1000 [01:06<00:22, 11.22it/s]Extracting features:  75%|███████▌  | 752/1000 [01:06<00:22, 10.86it/s]Extracting features:  75%|███████▌  | 754/1000 [01:07<00:22, 10.92it/s]Extracting features:  76%|███████▌  | 756/1000 [01:07<00:21, 11.47it/s]Extracting features:  76%|███████▌  | 758/1000 [01:07<00:21, 11.08it/s]Extracting features:  76%|███████▌  | 760/1000 [01:07<00:21, 11.20it/s]Extracting features:  76%|███████▌  | 762/1000 [01:07<00:20, 11.60it/s]Extracting features:  76%|███████▋  | 764/1000 [01:07<00:21, 11.13it/s]Extracting features:  77%|███████▋  | 766/1000 [01:08<00:20, 11.33it/s]Extracting features:  77%|███████▋  | 768/1000 [01:08<00:20, 11.26it/s]Extracting features:  77%|███████▋  | 770/1000 [01:08<00:20, 11.31it/s]Extracting features:  77%|███████▋  | 772/1000 [01:08<00:21, 10.85it/s]Extracting features:  77%|███████▋  | 774/1000 [01:08<00:20, 11.04it/s]Extracting features:  78%|███████▊  | 776/1000 [01:08<00:20, 11.13it/s]Extracting features:  78%|███████▊  | 778/1000 [01:09<00:20, 10.88it/s]Extracting features:  78%|███████▊  | 780/1000 [01:09<00:19, 11.03it/s]Extracting features:  78%|███████▊  | 782/1000 [01:09<00:20, 10.75it/s]Extracting features:  78%|███████▊  | 784/1000 [01:09<00:20, 10.54it/s]Extracting features:  79%|███████▊  | 786/1000 [01:09<00:20, 10.51it/s]Extracting features:  79%|███████▉  | 788/1000 [01:10<00:20, 10.46it/s]Extracting features:  79%|███████▉  | 790/1000 [01:10<00:20, 10.12it/s]Extracting features:  79%|███████▉  | 792/1000 [01:10<00:20, 10.04it/s]Extracting features:  79%|███████▉  | 794/1000 [01:10<00:21,  9.70it/s]Extracting features:  80%|███████▉  | 796/1000 [01:10<00:19, 10.24it/s]Extracting features:  80%|███████▉  | 798/1000 [01:11<00:19, 10.17it/s]Extracting features:  80%|████████  | 800/1000 [01:11<00:18, 10.77it/s]Extracting features:  80%|████████  | 802/1000 [01:11<00:18, 10.81it/s]Extracting features:  80%|████████  | 804/1000 [01:11<00:17, 11.13it/s]Extracting features:  81%|████████  | 806/1000 [01:11<00:17, 11.21it/s]Extracting features:  81%|████████  | 808/1000 [01:11<00:17, 11.12it/s]Extracting features:  81%|████████  | 810/1000 [01:12<00:16, 11.25it/s]Extracting features:  81%|████████  | 812/1000 [01:12<00:17, 10.89it/s]Extracting features:  81%|████████▏ | 814/1000 [01:12<00:17, 10.76it/s]Extracting features:  82%|████████▏ | 816/1000 [01:12<00:16, 10.94it/s]Extracting features:  82%|████████▏ | 818/1000 [01:12<00:16, 10.95it/s]Extracting features:  82%|████████▏ | 820/1000 [01:13<00:16, 11.00it/s]Extracting features:  82%|████████▏ | 822/1000 [01:13<00:16, 11.06it/s]Extracting features:  82%|████████▏ | 824/1000 [01:13<00:16, 10.93it/s]Extracting features:  83%|████████▎ | 826/1000 [01:13<00:15, 11.08it/s]Extracting features:  83%|████████▎ | 828/1000 [01:13<00:15, 11.01it/s]Extracting features:  83%|████████▎ | 830/1000 [01:14<00:16, 10.62it/s]Extracting features:  83%|████████▎ | 832/1000 [01:14<00:15, 10.81it/s]Extracting features:  83%|████████▎ | 834/1000 [01:14<00:15, 10.40it/s]Extracting features:  84%|████████▎ | 836/1000 [01:14<00:16, 10.12it/s]Extracting features:  84%|████████▍ | 838/1000 [01:14<00:15, 10.46it/s]Extracting features:  84%|████████▍ | 840/1000 [01:14<00:15, 10.63it/s]Extracting features:  84%|████████▍ | 842/1000 [01:15<00:15, 10.23it/s]Extracting features:  84%|████████▍ | 844/1000 [01:15<00:14, 10.41it/s]Extracting features:  85%|████████▍ | 846/1000 [01:15<00:14, 10.33it/s]Extracting features:  85%|████████▍ | 848/1000 [01:15<00:15,  9.96it/s]Extracting features:  85%|████████▌ | 850/1000 [01:15<00:15,  9.80it/s]Extracting features:  85%|████████▌ | 852/1000 [01:16<00:14, 10.47it/s]Extracting features:  85%|████████▌ | 854/1000 [01:16<00:14, 10.10it/s]Extracting features:  86%|████████▌ | 856/1000 [01:16<00:14, 10.28it/s]Extracting features:  86%|████████▌ | 858/1000 [01:16<00:13, 10.57it/s]Extracting features:  86%|████████▌ | 860/1000 [01:16<00:13, 10.49it/s]Extracting features:  86%|████████▌ | 862/1000 [01:17<00:12, 10.71it/s]Extracting features:  86%|████████▋ | 864/1000 [01:17<00:12, 10.50it/s]Extracting features:  87%|████████▋ | 866/1000 [01:17<00:13, 10.08it/s]Extracting features:  87%|████████▋ | 868/1000 [01:17<00:12, 10.25it/s]Extracting features:  87%|████████▋ | 870/1000 [01:17<00:12, 10.51it/s]Extracting features:  87%|████████▋ | 872/1000 [01:18<00:11, 10.97it/s]Extracting features:  87%|████████▋ | 874/1000 [01:18<00:11, 11.17it/s]Extracting features:  88%|████████▊ | 876/1000 [01:18<00:11, 11.09it/s]Extracting features:  88%|████████▊ | 878/1000 [01:18<00:11, 11.08it/s]Extracting features:  88%|████████▊ | 880/1000 [01:18<00:11, 10.36it/s]Extracting features:  88%|████████▊ | 882/1000 [01:18<00:10, 10.85it/s]Extracting features:  88%|████████▊ | 884/1000 [01:19<00:10, 11.26it/s]Extracting features:  89%|████████▊ | 886/1000 [01:19<00:10, 11.34it/s]Extracting features:  89%|████████▉ | 888/1000 [01:19<00:10, 10.57it/s]Extracting features:  89%|████████▉ | 890/1000 [01:19<00:10, 10.99it/s]Extracting features:  89%|████████▉ | 892/1000 [01:19<00:09, 11.05it/s]Extracting features:  89%|████████▉ | 894/1000 [01:20<00:09, 10.99it/s]Extracting features:  90%|████████▉ | 896/1000 [01:20<00:09, 11.03it/s]Extracting features:  90%|████████▉ | 898/1000 [01:20<00:09, 10.66it/s]Extracting features:  90%|█████████ | 900/1000 [01:20<00:09, 10.76it/s]Extracting features:  90%|█████████ | 902/1000 [01:20<00:09, 10.29it/s]Extracting features:  90%|█████████ | 904/1000 [01:21<00:09, 10.19it/s]Extracting features:  91%|█████████ | 906/1000 [01:21<00:08, 10.45it/s]Extracting features:  91%|█████████ | 908/1000 [01:21<00:09, 10.05it/s]Extracting features:  91%|█████████ | 910/1000 [01:21<00:08, 10.12it/s]Extracting features:  91%|█████████ | 912/1000 [01:21<00:08, 10.12it/s]Extracting features:  91%|█████████▏| 914/1000 [01:22<00:08,  9.95it/s]Extracting features:  92%|█████████▏| 916/1000 [01:22<00:08, 10.19it/s]Extracting features:  92%|█████████▏| 918/1000 [01:22<00:07, 10.26it/s]Extracting features:  92%|█████████▏| 920/1000 [01:22<00:07, 10.61it/s]Extracting features:  92%|█████████▏| 922/1000 [01:22<00:07, 10.49it/s]Extracting features:  92%|█████████▏| 924/1000 [01:22<00:06, 10.91it/s]Extracting features:  93%|█████████▎| 926/1000 [01:23<00:06, 10.67it/s]Extracting features:  93%|█████████▎| 928/1000 [01:23<00:06, 10.94it/s]Extracting features:  93%|█████████▎| 930/1000 [01:23<00:06, 11.20it/s]Extracting features:  93%|█████████▎| 932/1000 [01:23<00:05, 11.34it/s]Extracting features:  93%|█████████▎| 934/1000 [01:23<00:05, 11.34it/s]Extracting features:  94%|█████████▎| 936/1000 [01:24<00:06, 10.61it/s]Extracting features:  94%|█████████▍| 938/1000 [01:24<00:05, 10.94it/s]Extracting features:  94%|█████████▍| 940/1000 [01:24<00:05, 11.22it/s]Extracting features:  94%|█████████▍| 942/1000 [01:24<00:05, 11.36it/s]Extracting features:  94%|█████████▍| 944/1000 [01:24<00:04, 11.29it/s]Extracting features:  95%|█████████▍| 946/1000 [01:24<00:04, 10.98it/s]Extracting features:  95%|█████████▍| 948/1000 [01:25<00:04, 10.66it/s]Extracting features:  95%|█████████▌| 950/1000 [01:25<00:04, 10.61it/s]Extracting features:  95%|█████████▌| 952/1000 [01:25<00:04, 10.74it/s]Extracting features:  95%|█████████▌| 954/1000 [01:25<00:04, 10.73it/s]Extracting features:  96%|█████████▌| 956/1000 [01:25<00:03, 11.12it/s]Extracting features:  96%|█████████▌| 958/1000 [01:26<00:03, 11.19it/s]Extracting features:  96%|█████████▌| 960/1000 [01:26<00:03, 11.27it/s]Extracting features:  96%|█████████▌| 962/1000 [01:26<00:03, 10.96it/s]Extracting features:  96%|█████████▋| 964/1000 [01:26<00:03, 10.21it/s]Extracting features:  97%|█████████▋| 966/1000 [01:26<00:03, 10.82it/s]Extracting features:  97%|█████████▋| 968/1000 [01:27<00:03, 10.35it/s]Extracting features:  97%|█████████▋| 970/1000 [01:27<00:02, 10.49it/s]Extracting features:  97%|█████████▋| 972/1000 [01:27<00:02, 10.78it/s]Extracting features:  97%|█████████▋| 974/1000 [01:27<00:02, 10.78it/s]Extracting features:  98%|█████████▊| 976/1000 [01:27<00:02, 10.88it/s]Extracting features:  98%|█████████▊| 978/1000 [01:27<00:02, 10.89it/s]Extracting features:  98%|█████████▊| 980/1000 [01:28<00:01, 10.94it/s]Extracting features:  98%|█████████▊| 982/1000 [01:28<00:01, 10.99it/s]Extracting features:  98%|█████████▊| 984/1000 [01:28<00:01, 10.65it/s]Extracting features:  99%|█████████▊| 986/1000 [01:28<00:01, 10.71it/s]Extracting features:  99%|█████████▉| 988/1000 [01:28<00:01, 10.53it/s]Extracting features:  99%|█████████▉| 990/1000 [01:29<00:00, 10.12it/s]Extracting features:  99%|█████████▉| 992/1000 [01:29<00:00, 10.19it/s]Extracting features:  99%|█████████▉| 994/1000 [01:29<00:00, 10.39it/s]Extracting features: 100%|█████████▉| 996/1000 [01:29<00:00, 10.91it/s]Extracting features: 100%|█████████▉| 998/1000 [01:29<00:00, 10.91it/s]Extracting features: 100%|██████████| 1000/1000 [01:29<00:00, 10.87it/s]Extracting features: 100%|██████████| 1000/1000 [01:29<00:00, 11.11it/s]
2026-01-13 04:21:06,885 | INFO | Train feature shape: (1000, 196608)
2026-01-13 04:21:06,885 | INFO | 
--- Extracting Test Features (gold_106) ---
Extracting features:   0%|          | 0/106 [00:00<?, ?it/s]Extracting features:   1%|          | 1/106 [00:00<00:12,  8.66it/s]Extracting features:   2%|▏         | 2/106 [00:00<00:11,  9.25it/s]Extracting features:   3%|▎         | 3/106 [00:00<00:11,  9.05it/s]Extracting features:   4%|▍         | 4/106 [00:00<00:11,  9.05it/s]Extracting features:   5%|▍         | 5/106 [00:00<00:11,  8.99it/s]Extracting features:   6%|▌         | 6/106 [00:00<00:11,  8.84it/s]Extracting features:   8%|▊         | 8/106 [00:00<00:10,  9.50it/s]Extracting features:   9%|▉         | 10/106 [00:01<00:10,  9.57it/s]Extracting features:  10%|█         | 11/106 [00:01<00:10,  9.37it/s]Extracting features:  11%|█▏        | 12/106 [00:01<00:09,  9.52it/s]Extracting features:  12%|█▏        | 13/106 [00:01<00:10,  9.26it/s]Extracting features:  14%|█▍        | 15/106 [00:01<00:09,  9.22it/s]Extracting features:  15%|█▌        | 16/106 [00:01<00:09,  9.04it/s]Extracting features:  16%|█▌        | 17/106 [00:01<00:09,  9.23it/s]Extracting features:  17%|█▋        | 18/106 [00:01<00:09,  9.10it/s]Extracting features:  18%|█▊        | 19/106 [00:02<00:09,  8.96it/s]Extracting features:  20%|█▉        | 21/106 [00:02<00:09,  9.07it/s]Extracting features:  22%|██▏       | 23/106 [00:02<00:08,  9.30it/s]Extracting features:  23%|██▎       | 24/106 [00:02<00:09,  9.10it/s]Extracting features:  24%|██▎       | 25/106 [00:02<00:08,  9.20it/s]Extracting features:  25%|██▍       | 26/106 [00:02<00:08,  9.02it/s]Extracting features:  25%|██▌       | 27/106 [00:02<00:08,  9.18it/s]Extracting features:  27%|██▋       | 29/106 [00:03<00:08,  9.46it/s]Extracting features:  28%|██▊       | 30/106 [00:03<00:08,  9.28it/s]Extracting features:  29%|██▉       | 31/106 [00:03<00:08,  9.26it/s]Extracting features:  30%|███       | 32/106 [00:03<00:08,  9.06it/s]Extracting features:  31%|███       | 33/106 [00:03<00:08,  8.84it/s]Extracting features:  33%|███▎      | 35/106 [00:03<00:07,  9.43it/s]Extracting features:  34%|███▍      | 36/106 [00:03<00:07,  9.42it/s]Extracting features:  35%|███▍      | 37/106 [00:04<00:07,  9.18it/s]Extracting features:  36%|███▌      | 38/106 [00:04<00:07,  8.99it/s]Extracting features:  37%|███▋      | 39/106 [00:04<00:07,  8.83it/s]Extracting features:  38%|███▊      | 40/106 [00:04<00:07,  8.75it/s]Extracting features:  39%|███▊      | 41/106 [00:04<00:07,  8.61it/s]Extracting features:  40%|███▉      | 42/106 [00:04<00:07,  8.61it/s]Extracting features:  41%|████      | 43/106 [00:04<00:07,  8.58it/s]Extracting features:  42%|████▏     | 45/106 [00:04<00:06,  8.87it/s]Extracting features:  43%|████▎     | 46/106 [00:05<00:06,  8.78it/s]Extracting features:  44%|████▍     | 47/106 [00:05<00:06,  8.88it/s]Extracting features:  45%|████▌     | 48/106 [00:05<00:06,  8.80it/s]Extracting features:  46%|████▌     | 49/106 [00:05<00:06,  8.81it/s]Extracting features:  48%|████▊     | 51/106 [00:05<00:06,  9.05it/s]Extracting features:  49%|████▉     | 52/106 [00:05<00:05,  9.21it/s]Extracting features:  50%|█████     | 53/106 [00:05<00:05,  9.04it/s]Extracting features:  51%|█████     | 54/106 [00:05<00:05,  8.88it/s]Extracting features:  52%|█████▏    | 55/106 [00:06<00:05,  8.78it/s]Extracting features:  53%|█████▎    | 56/106 [00:06<00:05,  8.70it/s]Extracting features:  54%|█████▍    | 57/106 [00:06<00:05,  8.65it/s]Extracting features:  55%|█████▍    | 58/106 [00:06<00:05,  8.91it/s]Extracting features:  56%|█████▌    | 59/106 [00:06<00:05,  8.81it/s]Extracting features:  57%|█████▋    | 60/106 [00:06<00:05,  9.11it/s]Extracting features:  58%|█████▊    | 61/106 [00:06<00:04,  9.11it/s]Extracting features:  58%|█████▊    | 62/106 [00:06<00:04,  8.92it/s]Extracting features:  59%|█████▉    | 63/106 [00:06<00:04,  8.79it/s]Extracting features:  60%|██████    | 64/106 [00:07<00:04,  8.71it/s]Extracting features:  62%|██████▏   | 66/106 [00:07<00:04,  9.33it/s]Extracting features:  63%|██████▎   | 67/106 [00:07<00:04,  9.11it/s]Extracting features:  64%|██████▍   | 68/106 [00:07<00:04,  9.11it/s]Extracting features:  65%|██████▌   | 69/106 [00:07<00:04,  9.11it/s]Extracting features:  67%|██████▋   | 71/106 [00:07<00:03,  9.58it/s]Extracting features:  68%|██████▊   | 72/106 [00:07<00:03,  9.48it/s]Extracting features:  69%|██████▉   | 73/106 [00:08<00:03,  9.18it/s]Extracting features:  70%|██████▉   | 74/106 [00:08<00:03,  9.01it/s]Extracting features:  72%|███████▏  | 76/106 [00:08<00:03,  9.14it/s]Extracting features:  73%|███████▎  | 77/106 [00:08<00:03,  8.99it/s]Extracting features:  74%|███████▎  | 78/106 [00:08<00:03,  8.87it/s]Extracting features:  75%|███████▍  | 79/106 [00:08<00:03,  8.76it/s]Extracting features:  75%|███████▌  | 80/106 [00:08<00:02,  8.69it/s]Extracting features:  76%|███████▋  | 81/106 [00:08<00:02,  8.94it/s]Extracting features:  77%|███████▋  | 82/106 [00:09<00:02,  8.95it/s]Extracting features:  78%|███████▊  | 83/106 [00:09<00:02,  8.83it/s]Extracting features:  79%|███████▉  | 84/106 [00:09<00:02,  8.73it/s]Extracting features:  81%|████████  | 86/106 [00:09<00:02,  9.18it/s]Extracting features:  82%|████████▏ | 87/106 [00:09<00:02,  9.17it/s]Extracting features:  83%|████████▎ | 88/106 [00:09<00:01,  9.01it/s]Extracting features:  84%|████████▍ | 89/106 [00:09<00:01,  8.86it/s]Extracting features:  85%|████████▍ | 90/106 [00:09<00:01,  8.75it/s]Extracting features:  87%|████████▋ | 92/106 [00:10<00:01,  8.99it/s]Extracting features:  88%|████████▊ | 93/106 [00:10<00:01,  8.87it/s]Extracting features:  89%|████████▊ | 94/106 [00:10<00:01,  8.75it/s]Extracting features:  90%|████████▉ | 95/106 [00:10<00:01,  8.98it/s]Extracting features:  91%|█████████ | 96/106 [00:10<00:01,  8.87it/s]Extracting features:  92%|█████████▏| 97/106 [00:10<00:01,  8.72it/s]Extracting features:  92%|█████████▏| 98/106 [00:10<00:00,  8.64it/s]Extracting features:  93%|█████████▎| 99/106 [00:10<00:00,  8.59it/s]Extracting features:  94%|█████████▍| 100/106 [00:11<00:00,  8.57it/s]Extracting features:  95%|█████████▌| 101/106 [00:11<00:00,  8.55it/s]Extracting features:  96%|█████████▌| 102/106 [00:11<00:00,  8.67it/s]Extracting features:  97%|█████████▋| 103/106 [00:11<00:00,  8.64it/s]Extracting features:  98%|█████████▊| 104/106 [00:11<00:00,  8.70it/s]Extracting features:  99%|█████████▉| 105/106 [00:11<00:00,  8.75it/s]Extracting features: 100%|██████████| 106/106 [00:11<00:00,  9.01it/s]
2026-01-13 04:21:18,678 | INFO | Test feature shape: (106, 196608)
2026-01-13 04:21:18,679 | INFO | 
--- Training & Evaluation ---
2026-01-13 04:21:21,240 | INFO | Training linear probe...
2026-01-13 04:21:36,934 | INFO | Training CV AUROC: 0.9572 (+/- 0.0095)
2026-01-13 04:21:39,855 | INFO | Test AUROC (gold_106): 0.5854
2026-01-13 04:21:39,856 | INFO | 
Classification Report (gold_106):
2026-01-13 04:21:39,860 | INFO |               precision    recall  f1-score   support

      non-AF       0.57      0.65      0.61        55
          AF       0.56      0.47      0.51        51

    accuracy                           0.57       106
   macro avg       0.56      0.56      0.56       106
weighted avg       0.57      0.57      0.56       106

2026-01-13 04:21:39,863 | INFO | 
Results saved: results/experiment_20260113_041923.json
2026-01-13 04:21:39,864 | INFO | Predictions saved: results/gold_106_predictions.json
2026-01-13 04:21:39,864 | INFO | 
======================================================================
2026-01-13 04:21:39,864 | INFO | SUMMARY
2026-01-13 04:21:39,864 | INFO | ======================================================================
2026-01-13 04:21:39,864 | INFO | Train CV AUROC: 0.9572
2026-01-13 04:21:39,864 | INFO | gold_106 AUROC: 0.5854
2026-01-13 04:21:39,864 | INFO | Train/Test Gap: 0.3718
